編號,型式,測照地點,測照方向,速限,行政區,測照型式,座標緯度,座標經度
233,雷達數位,旗山區台29線旗甲路三段58公里274公尺,南向北,60,旗山,超速,22.943382,120.508475
234,雷達數位,旗山區台3線旗屏二路與高92線口,南北向,70,旗山,超速,22.845268,120.504726
235,非線圈數位雷射,旗山區中華路與延平一路口,南向北,50,旗山,闖紅燈兼超速,22.88167,120.4847189
236,線圈數位,鳳山區鳳頂路與田中央路口,南向北,60,鳳山,闖紅燈,22.59445,120.359211
237,非線圈數位雷射,鳳山區國泰路二段與五甲一路口,北向南,60,鳳山,闖紅燈,22.616306,120.353083
238,線圈數位,鳳山區建國路三段與青年路二段口,東向西,60,鳳山,闖紅燈,22.63744,120.350961
239,線圈數位,鳳山區南華一路保安二街口,東向西,50,鳳山,闖紅燈,22.597925,120.341869
240,線圈數位,鳳山區建國路三段與澄清路口,東向西,50,鳳山,闖紅燈,22.636531,120.344831
241,線圈數位,鳳山區中山東路與光遠路口,南向北,50,鳳山,闖紅燈,22.623114,120.368352
242,雷達數位,鳳山區鳳頂路台糖加油站對面,北向南,60,鳳山,超速,22.598097,120.360016
243,非線圈數位雷射,鳳山區國泰路一段與鳳頂路口,西向東,50,鳳山,闖紅燈,22.614566,120.36204
244,非線圈數位雷射雷達,鳳山區南華一路與和成路,西向東,60,鳳山,闖紅燈,22.594791,120.344027
245,非線圈數位雷射雷達,鳳山區國泰路二段與南京路口,北向南,60,鳳山,闖紅燈兼超速,22.622242,120.344934
246,非線圈數位雷射雷達,鳳山區鳳頂路與過埤路口,北向南,60,鳳山,闖紅燈兼超速,22.590568,120.358733
247,非線圈數位雷射雷達,鳳山區臨海路與南華一路口,南向北,50至40,鳳山,闖紅燈,22.597889,120.341283
248,非線圈數位雷射,鳳山區過埤路與鳳頂路口快車道,東向西,60,鳳山,闖紅燈兼路口科技執法監測,22.5903729,120.3593547
249,雷達數位,鳳山區南華一路與鳳甲路口,東向西,50,鳳山,超速,22.5950008,120.3440073
250,非線圈數位雷射,鳳山區保南二路與保義街口,南向北,50,鳳山,闖紅燈,22.595628,120.350048
251,雷達數位,鳳山區三商街高速公路口機慢車專用道往南415公尺處,北向南,40,鳳山,超速,22.592661,120.336328
252,非線圈數位雷射,鳳山區五甲一路與瑞隆東路口,北向南,40,鳳山,闖紅燈,22.607111,120.347
253,線圈數位,橋頭區成功南路仕隆路口,北向南,60,橋頭,闖紅燈,22.754935,120.311587
254,雷達數位,橋頭區白樹路175號對面,西向東,40,橋頭,超速,22.757953,120.302545
255,非線圈數位雷射雷達,橋頭區成功北路與新興路,北向南,60,橋頭,闖紅燈,22.759935,120.30955
256,非線圈數位雷射雷達,橋頭區成功北路與鐵道北路,北向南,60,橋頭,闖紅燈,22.767154,120.305743
257,雷達數位,橋頭區成功南路與經武路口,北向南,60,橋頭,超速,22.743445,120.316905
258,雷達數位,燕巢區旗楠路段鳳旗路44號之10旁,東向西,50,燕巢,超速,22.755227,120.356279
259,線圈數位,中興路與南一巷口燕巢國中前,北向南,60,燕巢,闖紅燈,22.786931,120.362362
260,非線圈數位雷射,燕巢區台22線深水國小前路口,東向西,50,燕巢,闖紅燈,22.777427,120.405887
261,雷達數位,燕巢區鳳澄路7之32號前,北向南,60,燕巢,超速,22.756254,120.363547
262,非線圈數位雷射雷達,燕巢區深中路台22線國立高雄科學大學燕巢校區前,西向東,60,燕巢,闖紅燈兼超速,22.77223,120.399461
